Interview_ID,Response,Theme,Subtheme,Respondent_Type,Respondent_Affiliation,Location,Contextual_Clues,Contradictions,Additional_Notes
R13,"Now, the biggest challenge within our democracy is the increasing influence of money in politics. Whether it’s elections or political parties, those with financial power are gaining dominance. We’ve seen instances where individuals with multiple criminal cases against them have managed to win elections even from jail. Muscle power and money power are dominating. Some offenders with serious criminal backgrounds, whose crimes remain unproven due to the system, are now reaching decision-making positions through politics. This weakens democracy. Take, for example, the elections for Gram Pradhan (village head). In larger village assemblies, candidates are spending lakhs, even crores of rupees. Similarly, in assembly elections, crores of rupees are being spent—spending 5–6 crores is now seen as routine. When a representative wins after spending such huge sums of money, they naturally think, ""I spent 10 crores to become an MLA, so I need to earn even more to recoup that investment and prepare for the next election."" This creates a problematic situation. Today, if an honest, intelligent, and thoughtful person wants to contest elections, people see them as naïve. Such individuals struggle to succeed. This is a dark side of democracy where capable and honest people are not advancing, while manipulative individuals and those who have amassed wealth through illegitimate means are moving ahead. These individuals, once elected as MLAs or MPs, eventually become ministers and take on decision-making roles. This growing trend of prioritizing money and muscle power over integrity is a major concern for our democracy.",Democracy_Trends,Financial_Dominance,Party,BJP,Uttarakhand,Context of the respondent being a member of the BJP but acknowledging the influence of money in politics undermining elections in democracy.,NA,"It is extremely interesting that the respondent, despite being a BJP member, is very forthcoming and talks in detail about how those with excess financial powers are gaining dominance and distorting Indian democracy. Also mentions that honest people attempting to contest elections are seen as naive. This is the ""dark side"" of Indian democracy according to the respondent, wherein capable and honest people are not advancing, but manipulative individuals and those who have amassed wealth through illegitimate means are moving ahead to decision-making roles. Obviously the respondent does not mention the BJP and frames it as a general ongoing scenario, but it is very interesting to note their honesty regardless."
R13,"Such financial dominance negatively affects democracy. If an educated individual, such as a respected school principal or a visionary thinker who has contributed significantly to society, wishes to contest elections, they simply can’t afford to. This leaves the field open for manipulative individuals who have amassed wealth through dubious means. Many contractors have now become legislators, and their primary focus upon winning is securing government contracts for themselves. Instead of addressing public concerns, they prioritize personal gain. This is one of the dark aspects of our democracy. Another is the role of media. While we consider media to be the fourth pillar of democracy, today, much of it is compromised. A significant portion—70–75% of newspapers and news channels—operates on a paid model, where content is dictated by financial transactions. People are unaware of this manipulation and assume what they read or see in the news is true. Instead, large deals ensure favorable coverage for some and silence on critical issues.",Democracy_Trends,Financial_Dominance,Party,BJP,Uttarakhand,Context of the respondent being a member of the BJP but acknowledging the influence of money in politics undermining media in democracy.,NA,"Again, it is extremely interesting that the respondent is very forthcoming in highlighting that the influence of money in current politics is also working to undermine democracy through its effects on ""buying out"" the media."
R19,"Take the example of the electoral bonds. Leaders have been jailed for alleged donations or corruption. Yet, entities accused of running liquor syndicates have become government witnesses and are donating to the BJP through these bonds. Similarly, many companies pressured through Income Tax investigations ended up donating to the BJP, and everything was suddenly deemed fine. Closer to home, take the incident with the Silk Road Tunnel here in Uttarakhand. That tragic event gained global attention, where labourers were trapped. Even then, the company involved gave donations to the BJP through electoral bonds, and everything was overlooked.",Democracy_Trends,Financial_Dominance,Government,INC,Uttarakhand,"Context of electoral bonds and of Uttarakhand, but the respondent is also a member of the opposition.",NA,BJP is singled out for profiting from electoral bonds through various examples.
R20,"Apart from organizational issues, the biggest challenge today is that earlier, parties used to generate their own support base. Now, we are more dependent on rich people. These wealthy individuals tend to align with the ruling party most of the time. They might give a small amount to the opposition or provide support to regional parties in power, but the majority of their share goes to the ruling party. Naturally, when the ruling party is financially stronger and the opposition is not, it creates an imbalance. As I mentioned, to strengthen the opposition, they need to cultivate a dedicated workforce. They should also focus on fundraising for their party and ensure that their worker base extends to the booth level.",Democracy_Trends,Financial_Dominance,Government,INC,Uttarakhand,NA,NA,"Although the respondent acknowledges the opposition receiving financial donations, they are regarded as small in comparison to the sums receieved by the BJP, which creates an ""imbalance"". Respondent encourages the opposition to focus more on fundraising and cultivating a dedicated workforce to counter the BJP."
R2,"You know what this Kharge is saying, the Congress President, that there wouldn’t be any elections if Modi comes back to power in 2024. I don’t think so. I don’t think so. One can manipulate one’s wins, and maybe that happens, but to change the constitution to that extent, I doubt in a country like ours. I am hopeful it won’t come to that.",Democracy_Trends,Process_Stability,Media,Neutral,Uttar_Pradesh,NA,NA,NA
R2,"The future of democracy can be bright. The power of vote is very important, and Indian voter, as I told you at the beginning, is very intelligent. Don’t underestimate the power of the Indian voter. They voted out Indira Gandhi and they also brought her back. She was as powerful as Narendra Modi is today.",Democracy_Trends,Process_Stability,Media,Neutral,Uttar_Pradesh,NA,NA,"The respondent highlights that Indian voters still have the power to vote Narendra Modi out, just as they did with Indira Gandhi."
R4,"Democracies around the world share similarities—some are better, some are worse. For instance, take Pakistan, where governments have been toppled through vote manipulations. That doesn’t happen here; our system doesn’t allow votes to be altered like that.",Democracy_Trends,Process_Stability,Media,Neutral,India,Context of comparison with neighbouring countries to highlight Indian democracy as stable.,NA,This respondent maintains that democracy in India is stable beause the country's systems does not allow votes to be altered and governments to be toppled like in Pakistan.
R4,"The current state of democracy is quite good, especially when we compare it to neighboring countries. However, ""good"" doesn’t mean perfect—it indicates that there is always room for improvement. These improvements, for now, seem to be surface-level. True progress would mean strengthening democracy at the grassroots level. The stronger the roots, the stronger the tree—just as a building’s foundation determines its strength. Right now, the structure looks good, shiny, and appealing on the outside, but its roots aren’t as strong as they need to be. There’s a pressing need to focus on strengthening those roots.",Democracy_Trends,Process_Stability,Media,Neutral,India,Context of comparison with neighbouring countries to highlight Indian democracy as stable.,NA,"Despite maintaining that the current state of democracy in India is ""quite good"", especially when compared to its neighbouring countries, the respondent still remarks that democracy is only shiny on the outside and that there is room for improvement with its roots. "
R9,"One of the most beautiful aspects of Indian democracy is that the opposition can freely voice its opinions and criticize the government. The government listens to such criticisms and acts upon them. Unlike in China, where criticism can lead to arrest, such suppression doesn’t happen here. That is the beauty of our democracy—it encourages dialogue and action based on constructive feedback.",Democracy_Trends,Process_Stability,Party,BJP,India,Context of comparison with neighbouring countries to highlight Indian democracy as stable.,"Most interestingly, they are the only respondent to cite the reason for Indian democracy's stability as freedom for the opposition to criticise the government. While not entirely false or internally inconsistent, it should still be noted that an overwhelming number of respondents noted otherwise.",This respondent also compares Indian democracy to China's to prove it to be stable.
R13,"Numerous countries proclaim themselves as democratic, but the structures of democracy that India has built since independence in 1947—or, more specifically, since 1950 when our Constitution was implemented—have continually grown stronger. If we compare this to countries like Pakistan, which became independent around the same time as us, Pakistan has struggled to establish practical democracy. Similarly, China claims democratic ideals, with promises of elected governments, but its president has structured the system to remain in power for life. When compared to such nations, India has greatly strengthened its democratic framework.",Democracy_Trends,Process_Stability,Party,BJP,Uttarakhand,Context of comparison with neighbouring countries to highlight Indian democracy as stable.,NA,"Another respondent that argues that the democratic structures of India are stable and have only grown stronger with time, but the only evidence put forth is comparison with Pakistan and China."
R13,"Look, the people across the entire country are happy with democracy. There’s no place where people are outright dissatisfied with the democratic system. However, in some states, the governance and systems of elected leaders are not up to the mark. Over time, the public recognizes this and takes steps to change those leaders.",Democracy_Trends,Process_Stability,Party,BJP,Uttarakhand,Context of turnover at the subnational level.,NA,"As evidence of the stability of democracy, respondent asserts that in whichever states people are unhappy with their leaders, they're able to change those leaders."
R13,"The periodic elections every five years inspire immense public trust. The people believe that if the government they elected does not perform well, they can replace it in five years. This belief has significantly shaped our democracy. As a result, even long-standing and seemingly invincible governments have been removed by the people's will. For instance, in Bihar, Lalu Prasad Yadav served as Chief Minister for 15 years across three terms, maintaining a stronghold over governance. At the time, it seemed impossible to unseat him. However, the people recognized the need for change and voted him out, ushering in a new government. Similarly, in Uttar Pradesh, Mulayam Singh Yadav once dominated the state's politics. During his tenure, democratic values were trampled upon, and the Ram Mandir movement became a significant issue. We believe that the suppression and persecution by Mulayam Singh Yadav played a crucial role in making the Ram Mandir movement successful. People perceived him as a harsh ruler and ousted him from power. At the national level, something similar happened with Indira Gandhi. During her tenure as Prime Minister, there was a saying: ""India is Indira, and Indira is India."" This phrase symbolized her dominance, where she became synonymous with the nation itself. She was considered an unmatched and formidable leader. However, when she imposed Emergency, suspending the fundamental rights of citizens and jailing opposition leaders, the people rejected her. In 1980, they voted her out of power, electing the Janata Party to form the government. This demonstrates how deeply the Indian populace has embraced the principles of democracy enshrined in our Constitution. The people not only understand the rights granted to them but also actively exercise them, ensuring that their democracy thrives and evolves over time.",Democracy_Trends,Process_Stability,Party,BJP,Uttarakhand,Context of turnover at the subnational level.,NA,"Instances of turnover in Uttar Pradesh, Bihar cited as evidence."
R14,"Indian democracy is remarkable. Look at how, unlike many other countries, there is no need for revolutions or bloodshed to change governments. Governments, whether at the state or central level, are replaced peacefully through the power of public voting. This voting right is one of the strongest pillars of Indian democracy, as it allows the people to choose their governments.",Democracy_Trends,Process_Stability,Government,BJP,Uttarakhand,Context of comparison with neighbouring countries to highlight Indian democracy as stable.,NA,"Indian democracy is stable because there is no need for revolutions or violence to change governments, but the government has not been changed at the national level for more than a decade, so presumably this respondent is talking about the transfer of power at the subnational level."
R14,"Governments are always democratic because that is how our country remains a democracy. Take, for instance, countries like China or Russia. They conduct elections just for show—no one can vote against the ruling party. But here in India, people have the power to decide. They can vote for the government they want to retain or vote to replace it. That is the greatest strength of democracy—governments are formed and removed through the power of voting, not through revolutions or violent struggles. Whether at the state level or the national level, people can bring about change through the strength of their vote.",Democracy_Trends,Process_Stability,Government,BJP,Uttarakhand,Context of comparison with neighbouring countries to highlight Indian democracy as stable and of turnover at the subnational level.,NA,"My assumption about the respondent talking about the transfer of power at the state level is confirmed. Again, another respondent who compares Indian democracy with Russia and China to highlight its comparative strength. It is interesting that most of the respondents who argue Indian democracy to be stable demonstrate its stability only in comparison to closed authoritarian regimes."
R14,"Indian democracy is very strong, and the Election Commission plays a critical role in maintaining this strength. The Election Commission must continue its efforts to ensure free and fair elections so that people maintain their trust in the electoral process. If the Commission fulfils its responsibility, democracy will remain robust, and the people will continue to have faith in it.",Democracy_Trends,Process_Stability,Government,BJP,Uttarakhand,Context of Election Commission,Interesting because what this respondent claims goes directly about what the ex-Chief Election Commissioner confided in their interview.,NA
R17,"Look, the rules being made at the center follow the democratic process. Any law created by the center is formed through parliamentary procedure and amendments. Democracy dictates that the majority rules. The parliament's procedure ensures that laws passed are to be applied universally, regardless of which party representatives belong to—even if they are in the minority. If parties are part of parliament yet refuse to accept its rules, they are creating a dangerous precedent.",Democracy_Trends,Process_Stability,Government,BJP,Uttarakhand,"Context of Farmers Law, CAA, etc.",NA,"The respondent highlights that Indian democracy is stable because democratic procedures and rules are being followed in the formulation of laws. But the respondent also goes on to add that the fact that some opposition leaders are questioning these laws made and passed through due process creates a dangerous precedent for democracy, which is certainly an interesting perspective."
R20,"The reason is that when we adopted the Constitution, it was done with great thought and consideration. The Constitution, crafted by Ambedkar, involved many significant, intelligent individuals who designed a democratic system. This is why India is today regarded as the largest democracy. Our elections, despite everything, still uphold their integrity. People often claim that elections in India are rigged, or they point fingers at EVMs being hacked. But I don’t believe that. It’s not an easy thing. Unless you have precise booth data—such as how many votes are cast in a specific booth, the percentage expected for Congress, the percentage for BJP—you cannot manipulate it. For instance, if it’s a Muslim-majority booth and you manipulate the data accordingly, you will get caught. So personally, I believe it’s not possible to hack EVMs. This is my personal opinion.",Democracy_Trends,Process_Stability,Government,INC,Uttarakhand,Context of the only opposition member being hopeful about the future of democracy in the country.,NA,The only member of opposition to express stability about the current condition of democracy. Reasons cited include the longstanding nature of our Constitution as well as the integrity of elections. Respondent claims such because it would be very hard to manipulate elections and not get caught.
R13,"Look, to safeguard democracy, the most important thing is to maintain stability within the country. For example, during the period between 1989 and 2014, we saw governments at the center working through collaborations. During Atal Ji’s time, a coalition of 28 parties ran the government. Similarly, there were allegations against Prime Minister Narasimha Rao that he had to resort to buying support to sustain his government. During B.P. Singh's tenure, collaboration politics prevailed, and even during Manmohan Singh Ji’s time, his government relied on the support of others. What happens in such coalition scenarios is that if a coalition partner is involved in unethical practices or makes demands harmful to the nation, the government often has to accommodate those demands just to remain in power. This instability and the compulsions of running a coalition government can be detrimental to the nation. To address this, stability is essential. At any level, having a clear majority is crucial. For example, since 2014, Modi Ji has been receiving a full majority, and because of this, he has been able to work decisively. Whether it’s decisions on foreign policy, internal matters, roads, railways, or aviation, he can make these decisions without being constrained by coalition partners or fearing their dissatisfaction. This stability, with one party having a clear majority, is critical for the nation’s development, for executing plans effectively, and for strengthening and empowering the country. Stability is key to ensuring democracy remains robust and effective.",Democracy_Trends,Majoritarian_Strength,Party,BJP,Uttarakhand,NA,"While this respondent believes that coalition politics has been ""bad"" for democracy and the stability of a majoritarian government is better for democracy because of effective decision-making, this runs counter to what a lot of other respondents have argued.",Respondent cites single party majority rule as necessary for strengthening democracy.
R16,"You may have seen how our democracy has progressed, even in Kashmir. Until recently, since independence, democracy had not reached there... Since India's independence, democracy was not present there (referring to Kashmir). The Indian flag, which was not hoisted there on January 26 earlier, is now hoisted on January 26.",Democracy_Trends,Majoritarian_Strength,Bureaucrat,Neutral,Uttarakhand,Context of Kashmir,"Multiple respondents highlighted what happened in Kashmir as contravening democracy but for this respondent it is a sign of the strenghtening of Indian democracy, although no justification is given why beyond national pride and internal security.","For this respondent, democracy in India is strong because now the Indian flag waves over Kashmir. Which is certainly an interesting response."
R16,"The democracy in India is alive. Across the world, India is recognized for its democracy, and this recognition exists because people here trust democracy and respect it. Compare our democracy—India’s democracy—with Pakistan’s democracy. Over there, democracy doesn’t truly exist; no one values it. The army there can topple the government anytime. But in India, we have a robust system. Since Prime Minister Narendra Modi took office, our democracy has become even stronger, to the extent that the entire world respects India. This is why our democracy is strong, and it is strong because the people of India—the 140 crore citizens—believe in it.",Democracy_Trends,Majoritarian_Strength,Bureaucrat,Neutral,Uttarakhand,Context of comparison with neighbouring countries to highlight Indian democracy as stable.,NA,Democracy is strong because it is sustained through the will of 140 crore people.
R17,"Now, if the BJP has a majority in the center, and if someone doesn’t like BJP’s principles, ideology, or work, they should approach the public. Convince the public, gain their support, win a majority, and govern as per their ideology. Today, the BJP has the majority. If people are satisfied with our work and our ideology, and they have voted us into power, then the opposition must accept it. If they have issues, they can present them in parliament. They can agitate and advocate for their causes—there is provision for that. Equal rights are granted to all. However, completely refusing to accept the laws made by parliament amounts to anti-national activity. It becomes anti-democratic. Such behavior undermines constitutional decisions. BJP is not forcing itself into power. The public elects us. We contest elections, and only if the public grants us a majority do we form the government. When we form the government, we address the issues for which the public elected us. If someone claims this is forceful, it’s entirely incorrect.",Democracy_Trends,Majoritarian_Strength,Government,BJP,Uttarakhand,"Context of Farmers Law, CAA, etc.","The respondent also adds that because of the BJP majority being a reflection of the masses, refusing to accept the laws made by the parliament amounts to anti-national activity. It becomes anti-democratic. Although the statement is not theoretically wrong, it is being made in the context of protests against some of the controversial laws passed by the BJP such as Farmers Law, CAA, or the abrogation of Article 370. While this respondent highlights protests against them as anti-democratic implicitly, many believe the laws to be anti-democratic to begin with.","Again, this respondent highlights that because the BJP is in centre through a majority, democracy is strong and serves as a reflection of the masses. They also go on to claim that the opposition can utilise the same democratic channels to obtain a majority of their own parties. "
R9,"The benchmark for any country’s progress is the development of every citizen. India is moving towards becoming a developed nation, and I don’t see major challenges to our democracy.",Democracy_Trends,Service_Improvement,Party,BJP,India,NA,NA,NA
R9,"India’s democracy is not under threat; rather, it is progressing towards inclusivity, aiming for “Sabka Saath, Sabka Vikas” (together with all, development for all). If democracy were truly under threat, BJP wouldn’t have won so many seats.",Democracy_Trends,Service_Improvement,Party,BJP,India,NA,NA,Respondent highlights both development measures by the BJP and the fact that the BJP obtained a majority as testament to the strength of democracy.
R9,"Over time, both democracy and development will evolve. As development progresses, people’s understanding and engagement with democracy will deepen. Changes in democracy are inevitable as societies grow.",Democracy_Trends,Service_Improvement,Party,BJP,India,NA,NA,NA
