Interview_ID,Response,Theme,Subtheme,Respondent_Type,Respondent_Affiliation,Location,Contextual_Clues,Contradictions,Additional_Notes
R11,"So, let’s take the case of Andhra Pradesh in the 80s. Ramoji Rao and Eenadu group from Andhra Pradesh. They emerged as a local corporate house. They controlled media, and through media they moved to finance and then some other real-estate businesses. And Ramoji Rao and Eenadu newspaper, they played a very important role in the rise of anti-Rama Rao and Telegu Desam Party in Andhra Pradesh. A very, very crucial role. So, in most of the states, wherever these regional parties roam, they are closely linked with the local capitalism or local big corporates who helped them. In Tamil Nadu, it was the Sun Group. Similarly, in Odisha and many other states. Now, because big corporates from Delhi and Mumbai have national aspirations and national markets, they’re crushing the smaller players. And the general nature of capitalism is that big fish always finishes the smaller ones. This is what we are witnessing. National parties are trying to overtake the smaller, regional parties in Indian state. These local parties have been important for state capital but also for state democracy. They may say that this is a natural phenomenon in capitalism.",Linkages,Fiscal_Linkages,Media,Neutral,India,"Tamil Nadu, Andhra Pradesh, Odisha, One Nation, Regional Differences",NA,"Party-Fiscal Overlap, Acknowledges the superior position of the Indian centre, Highlights incentives"
R12,"There was a session of three finance ministers, in which Chidambaram, the serving Finance Minister of Kerala, and just past Finance Minister of Tamil Nadu, studied from Harvard etc. All three made the case that through GST they have destroyed economic federalism and turned the states into beggars. Then in greater detail, in the Finance Commission, 32% of the share devolving into states was increased to 42. But after a little modification it became 41%. Then they say that everything has been since neutralized, now it is 30-32%. Because what they did was make it cesses and surcharges. Before, income tax and other taxes were divisible between centre and state. Cess and surcharges now are entirely for central government. Through this they increased their income, their share. Then there were central sponsored schemes, whose normal formula was 80-20. 80 from the centre and 20 from the state. First, they have reversed that. That the states should give 80 themselves, 20% will be given by Indian government. And they also turned the entire state into beggars. If you google, there is a 3-minute video of Tamil Nadu's finance minister. It is so brilliant; He tells the whole thing, look in what ways they have made us a beggar. They have made him an absolute beggar. Then the third thing which I did in this, and I have made a point today which everyone has registered. I said, sir, when this term was used - double engine government - everybody laughed. I said this is the biggest attack on democracy and federalism. What does it mean? If you don't vote for my party, I will starve your state's funds. Bastard, are these your father's funds? Do you give this from your own pocket? This term, look, I said I am surprised that you have so many professors sitting here, but who protested against this? And if there is someone from the media, which media protested against this? They were all just lost in the “funny nature” of the term. It’s the most dangerous attack and statement on democracy—this double engine sarkar. If you give a ticket to my party and vote for me, then I will give your states the funds, otherwise they will not get it, you will starve. These are the things said by these three finance ministers. We are being treated as beggars just for asking our dues. While 70% of the income comes from the states, only 30% will be returned—states are now contributing to the central government getting more funds. But centre gives it back to states by making them cry and making them beggars. This is a great attack on democracy and federalism... Authoritarian regime is confirmed.",Linkages,Fiscal_Linkages,Bureaucrat,Neutral,Delhi,"Kerala, Tamil Nadu, GST, Double Engine Government, BJP versus Opposition, Regional Differences",NA,"Party-Fiscal Overlap, Acknowledges the superior position of the Indian centre"
R13,"When there is coordination between the central and state governments, it leads to smooth functioning. However, conflicts can arise, such as the situation in West Bengal. When the Prime Minister visited West Bengal, the Chief Secretary of the state did not attend the meeting despite being summoned. Such incidents create hurdles in democratic functioning. Additionally, states rely heavily on funding and budgets allocated by the center. Many developmental plans and schemes are decided by institutions like the NITI Aayog. There are also central departments operating within states. If there is a lack of coordination or conflict between the center and the state, as seen in certain instances, it hampers the developmental progress of the state. In summary, while states have a degree of autonomy, their functioning is closely linked to and dependent on the center, and any discord can negatively impact governance and development.",Linkages,Fiscal_Linkages,Party,BJP,Uttarakhand,"West Bengal, Double Engine Government, BJP versus Opposition",NA,"Party-Fiscal Overlap, Acknowledges the superior position of the Indian centre"
R14,"If the same party governs both the center and the state, it generally leads to better cooperation. In such cases, state governments work actively to implement the central government's policies and provide full support in achieving their objectives. However, when different parties govern the center and the states, challenges arise. There can be conflicts between the two, especially if the state lacks sufficient resources of its own. States then become more dependent on the central government for development. For instance, after the implementation of GST, states rely on the central government for their share of revenue. If the same party governs at both levels, states tend to benefit more because there is smoother alignment in policy implementation and resource allocation.",Linkages,Fiscal_Linkages,Government,BJP,Uttarakhand,"GST, Double Engine Government, BJP versus Opposition",NA,"Party-Fiscal Overlap, Acknowledges the superior position of the Indian centre"
R14,"For any state to execute its plans, it needs to submit proposals like Detailed Project Reports (DPRs) to the central government to secure funding. Unless a state has abundant resources and is economically self-sufficient, it will rely on the center for financial support. There are very few states, like Jharkhand, that may have their own substantial resources. Most states depend on the center for funding.",Linkages,Fiscal_Linkages,Government,BJP,Uttarakhand,Jharkhand,NA,Acknowledges the superior position of the Indian centre
R14,"The importance of economic development in a democracy lies in the fact that the development of your region can only happen if your state government receives adequate funding. Without sufficient funds, progress will lag behind. Whether it is roads, drinking water, or any other developmental projects, they can only be completed with the availability of funds.",Linkages,Fiscal_Linkages,Government,BJP,Uttarakhand,NA,NA,"Acknowledges the superior position of the Indian centre, Highlights incentives"
R14,"Take Bengal and the centre, for example. The Ayushman Bharat scheme is implemented across India, but whether to implement it or not depends on the state government. This disconnect affects the benefits that the public should receive from the central government. If there’s no coordination between the state and the center, development is hindered. State governments often hesitate to implement central schemes because they fear that if the centre is the one putting the money, the credit will also go to the central government. Hence, they avoid implementing such schemes in their state.",Linkages,Fiscal_Linkages,Government,BJP,Uttarakhand,"West Bengal, BJP versus Opposition",NA,"Party-Fiscal Overlap, Highlights incentives"
R16,"If people from the same party govern—whether at the local, state, or central level—development work will proceed as a continuous chain. No one will have to depend on or wait for the other. If the state government is aligned with the central government, it becomes easier to receive an NOC or financial aid from the central government. This harmony between state and local governments ensures that development efforts are not disrupted, and resources are not misused.",Linkages,Fiscal_Linkages,Bureaucrat,Neutral,Uttarakhand,Double Engine Government,NA,"Party-Fiscal Overlap, Acknowledges the superior position of the Indian centre"
R20,"That’s natural; it’s part of party politics, but it shouldn’t be that way. I feel there shouldn’t be any discrimination. For example, in 2002, when Narayan Dutt Tiwari became the Chief Minister and Atal Bihari Vajpayee was the Prime Minister at the center, they had a very good relationship. Vajpayee provided funds, and Tiwari skillfully brought that money to the state because he was an intelligent leader. But today, we see situations where there’s tension, especially when different parties govern at the center and in the state. However, I believe that for the democratic system, such pulling and pushing should not happen. The central government should treat states equally and fairly, as they are all part of the country. No state is outside the country, and they too have the right to development.",Linkages,Fiscal_Linkages,Government,INC,Uttarakhand,"Uttarakhand, Uttar Pradesh, Double Engine Government",NA,Party-Fiscal Overlap
R22,"Democracy should ensure equality, but you’ve seen how states like Bihar and Bengal have been treated unfairly. For example, in 2015, the Prime Minister announced a ?25,000 crore package for Bihar during an election rally. If you recall, this was repeated in the 2019 elections. However, not a single rupee of that package has been delivered. The central government is not providing assistance even where it is most needed, such as for clean drinking water, education, or road infrastructure development. They make grand announcements but fail to follow through.",Linkages,Fiscal_Linkages,Party,INC,Uttarakhand,"West Bengal, Bihar, BJP versus Opposition",NA,"Party-Fiscal Overlap, Acknowledges the superior position of the Indian centre"
R22,"The implementation of GST, for instance, has created significant problems. Earlier, we had a separate railway budget, but that too has been eliminated. Previously, we could predict the flow of money—how much would be earned and how it would be spent. But now, there is no clarity.",Linkages,Fiscal_Linkages,Party,INC,Uttarakhand,NA,NA,"Party-Fiscal Overlap, Acknowledges the superior position of the Indian centre"
R1,"Now, during election periods, raids are conducted everywhere. Be it in Madhya Pradesh or Chhattisgarh, where elections were held, raids are ongoing. These actions should have been carried out earlier, not during the elections. This has turned into a way to intimidate and politicize matters.",Subnational_Democracy_Trends,Subnational_Backsliding,Government,SP,Uttar_Pradesh,"Madhya Pradesh, Chhattisgarh, BJP Involvement",NA,Negative Subnational Political Engineering
R1,"Right now, no difference is visible. Today, we are seeing all this “game”— take the ongoing spectacle in Bihar, where efforts are being made to bring Nitish Kumar into the BJP fold. Politics has become a game of ‘jod-tod’ (alliances and maneuvering), and whoever succeeds in this game is considered the ultimate creature of democracy. In today's era, the one who is in power is the one who is elected by the people. So, who are we to spoil it?",Subnational_Democracy_Trends,Subnational_Backsliding,Government,SP,Uttar_Pradesh,"Bihar, BJP Involvement",NA,Negative Subnational Political Engineering
R10,"BJP is trying to drill the democracy: they are trying to destroy the very fabric of democracy in India through lieutenant governors and governors. It is a very notional post, and a governor or NG is, since he is selected and not elected, merely a representative of the President of India. Instead of working with the state, with the advice of the cabinet and the government, they are basically doing whatever the BJP and central government is asking them to do. Be it with West Bengal, be it Punjab wherein they created chaos. Delhi is the brightest example, that’s also what is happening in Pondicherry. Everywhere. Even in Tamil Nadu, when there was a bill passed by the state government, and the BJP-appointed government sat on it for three years and only passed it when High Court slapped them.",Subnational_Democracy_Trends,Subnational_Backsliding,Government,AAP,Delhi,"Delhi, Punjab, Puducherry, West Bengal, Tamil Nadu, BJP Involvement",NA,Negative Subnational Direct Intervention
R10,"What has changed is that the BJP has stopped respecting the federal structure in this country. And if you will not respect the federal structure, it means you will not respect the constitution. The recent example is of Chandigarh. Mayor election took place in Chandigarh. BJP made its man, who had the authority, the Presiding Officer. That man admitted live on camera that he had tampered with the ballot papers. If you are not winning the elections, then you are buying people.",Subnational_Democracy_Trends,Subnational_Backsliding,Government,AAP,Delhi,"Chandigarh, BJP Involvement",NA,Negative Subnational Direct Intervention
R10,"Go to any state: If there is an anti-BJP government, there is competition in democracy but there is chaos in centre-state relations, and if there is a pro-BJP government, then there is peace but there is no governance because they do not have any concept or plan. Before what the BJP was doing, there was a space, this space for the opposition used to be there in states. BJP has been gradually, silently...not just silently, they are not even pretending, they are doing this openly and blatantly, I won’t say silently. They’ve been working very hard to shrink that space for the opposition. They’ve been working very hard to shrink that space for the opposition. For example, a recent example of Madhya Pradesh. Sindhya joined, was lured or threatened, whatever they could do they did it. And now, talks are that the first line of leadership, the ex-CM with his son and ten or twelve past MLAs are going to join the BJP. Space is gone. Where is the Space? There is a public who does not want to vote for the BJP, but there are no leaders who are leading them. There are compartments, but no engine. So, BJP wants to finish them off slowly and bring them to itself in some way or the other, so that they are not opposed there. If they are all singing the same tune in a state, there will be no opposition to them. Then they will do whatever they want.",Subnational_Democracy_Trends,Subnational_Backsliding,Government,AAP,Delhi,"Madhya Pradesh, BJP versus Opposition",NA,Negative Subnational Political Engineering
R10,"But what is the BJP doing? Ajeet Pawar. Hemant Biswa is the greatest example. When Hemant Biswa was in Congress Assam, BJP released a booklet on his thousand crore water scam. The moment he joined the BJP, he became the cleanest. Not just the cleanest one, he became the seniormost member of the BJP in Assam. Subendru Adhikari, Narda Sarda Chit Scam, they all became clean. What was the latest example—Adarsh Ghotala, Ashok Chawan—BJP fought against him tooth and nail but once he joined the party, nothing bad against them remained. So, in this way, by threatening or by tempting people with cash, BJP is killing the soul of democracy and also shrinking the space of the opposition. Which will eventually result in only BJP’s government everywhere else in India and thus no balance of power and thus no democracy because absolute power in a country corrupts absolutely. You see what will be the cascading effect of this.",Subnational_Democracy_Trends,Subnational_Backsliding,Government,AAP,Delhi,"Assam, BJP Involvement",NA,Negative Subnational Political Engineering
R11,"I feel that another major change that is taking place is that…the federal nature, yes, that too is at the risk of being eroded to a considerable extent. And there are centralizing tendencies within the Indian state. It is not that this is happening for the first time, but what we saw from the 1980s till the last decade was that a federal nature of politics was emerging—coalitions, number of parties, different governments in the state. It was very diverse and plural. Now, it is more of a centralized in nature, unitary in nature, and consists of toppling governments or not allowing elected governments to work. All these tendencies are against the federal idea. And this is the other major change that is taking place. Many people are worried about it, like the growing North-South divide or how it will play out in the future, nobody knows. But this is a major reason, I think.",Subnational_Democracy_Trends,Subnational_Backsliding,Media,Neutral,India,"Regional Differences, Federalism",NA,Centralization
R11,"But if it is only one regional aspirant competing in elections, then at the state-level also we are witnessing centralizing tendencies and capture in power...threatening democratic institutions, media, independent voices, even at the state level. They are almost copying the national leader or the national party at the state level. They are trying to finish off the opposition in those states…But if you go to, let’s say, West Bengal. Despite TMC being a regional party, you’ll see all the “undemocratic” tendencies in Trinamool. Because there is no other regional contender, a powerful regional contender.",Subnational_Democracy_Trends,Subnational_Backsliding,Media,Neutral,India,"West Bengal, Opposition Involvement",NA,Key for quotations
R11,"One thing that is clearly visible is that in the states where the BJP has ruled for a long time—like the case of Gujarat or Madhya Pradesh and now at least Uttar Pradesh and wherever they are able to repeat themselves—political competition has reduced considerably. They’re basically one-party states. We can definitely say this about Gujarat. It's a one-party state. The opposition is very weak. Very, very weak. There are no social or political movements. Everything is very controlled. Another model which is emerging in Uttar Pradesh is kind of a “police state,” where an ideologically powerful party is penetrating in different apparatuses of the state and using the state force to crush political dissenters. So, slowly and slowly the trend is visible in UP also, but right now there is still some competition in UP; I would not say that the competition is completely over. But at least in their biggest laboratory Gujarat, it’s a one-party rule. Completely. And it’s an ideological state, which means the whole state and its apparatuses are not indifferent to ideology; they are actually aligned with the ideology of the governing party. From the media to the judiciary to the executive in these states, everything. And slowly, you know, we are witnessing the same things happening in Madhya Pradesh. Next maybe UP if the BJP continues in ten years. Rajasthan may be kind of a sitting duck. It is open to good competition, but Congress is in opposition, and it is a weak opposition. Still, members and parties are changing, so you never know there.",Subnational_Democracy_Trends,Subnational_Backsliding,Media,Neutral,India,"Gujarat, Madhya Pradesh, Uttar Pradesh, Rajasthan, BJP Involvement",NA,"Decline of Political Competition, No Mobilizations, Policing, Institutional Decline"
R12,"No, look, this was also a hot topic today that the Supreme Court took such a dangerous decision that sitting in the Parliament it made Kashmir a Union Territory. Rather, two Union Territories. What is to stop them from making Tamil Nadu a Union Territory? After the judgement of the Supreme Court, if any state protests, then just make it a Union Territory. If you want, you can even make it four union territories. No one challenged the Supreme Court. The Supreme Court was disgraced. Well, Kashmir was a special case—Kashmir had to be integrated, national interest was involved. But has India's democracy and federalism become a waste?",Subnational_Democracy_Trends,Subnational_Backsliding,Bureaucrat,Neutral,Delhi,"Kashmir, BJP versus Opposition, Federalism",NA,Centralization
R12,"His [Modi’s] upbringing is just like this. He's a fascist. Totally fascist thinking. They want an authoritarian regime. That's why we were at the conference since morning on the—one nation, one election, actually federalism. That federalism may soon be in tatters as state power is being captured and the unitary government center is consolidating everything under itself. So, this is an attack on the basic structure of the Constitution. Speaker after speaker expressed concerns on this.",Subnational_Democracy_Trends,Subnational_Backsliding,Bureaucrat,Neutral,Delhi,"BJP Involvement, Federalism",NA,Centralization
R12,"If they come into power in more than half of the states in the future, they will surely make constitutional amendments. Now, if someone says that ""one nation, one election"", it is impossible because five articles of the constitution will have to be changed. But the entire constitution will be changed if they get the majority. So, what good are these five articles? Kashmir was abolished. Kashmir was made a Union Territory, right? And the seal of the Supreme Court was also put on it. Because their modus operandi is to blackmail everyone. They control all the institutions. They will open the files of ED, Income Tax etc., they will find some weakness of theirs, and then tell the Chief Justice that this is all the evidence against you, think about it, then tell us what should be done? This is happening. You should see what the judgements are of last 5-7 years.",Subnational_Democracy_Trends,Subnational_Backsliding,Bureaucrat,Neutral,Delhi,"BJP Involvement, Federalism",NA,"Centralization, Negative Subnational Direct Intervention"
R19,"Federalism is undoubtedly important. We have the central government, the state government, and smaller units like municipal bodies and village panchayats. Each has distinct powers and rights. This diversity strengthens democracy because people elect their representatives through their votes. That’s the beauty of this country: the power lies with the people who choose their representatives. However, if this system is interfered with or manipulated, it becomes inappropriate. Today, there’s a constant talk about breaking governments, and the manner in which legislators and Members of Parliament are being bought is a clear violation of democratic principles. This isn’t democracy—it’s an attempt to shift towards dictatorship.",Subnational_Democracy_Trends,Subnational_Backsliding,Government,INC,Uttarakhand,Federalism,NA,Negative Subnational Political Engineering
R19,"Just look at how elected state governments are being overthrown. Legislators are being encouraged to defect through financial inducements. When a party cannot form a government, they resort to using money to manipulate legislators to switch sides. This is how governments are being destabilized, and it’s a direct assault on democracy. Take the example of Madhya Pradesh: the BJP didn’t win the government; it was the Congress that formed it. Yet, through unethical means, the BJP managed to topple the government. Similar attempts were made in Rajasthan, and the same thing happened in Goa. Even here in Uttarakhand, look at what happened. A legitimately elected government was targeted, and efforts were made to destabilize it by the central government. This sort of interference and the undermining of the federal structure is a direct attack on democracy.",Subnational_Democracy_Trends,Subnational_Backsliding,Government,INC,Uttarakhand,"Madhya Pradesh, Rajasthan, Goa, Uttarakhand, BJP Involvement",NA,Negative Subnational Political Engineering
R19,"Look, BJP and the central government often talk about ""One Nation, One Election."" But if a different party’s government is formed in a state, does that mean the central government has a habit of trying to weaken that state government? They attempt to destabilize it, and if something happens in a state, they impose President’s Rule. But when the state government is functioning smoothly, they resort to breaking legislators apart. They use funds collected through electoral bonds to lure legislators and buy them. Is this appropriate for a healthy democracy? It certainly isn’t, but BJP is actively engaging in such practices.",Subnational_Democracy_Trends,Subnational_Backsliding,Government,INC,Uttarakhand,BJP Involvement,NA,"Negative Subnational Political Engineering, Negative Subnational Direct Intervention"
