Interview_ID,Response,Theme,Subtheme,Respondent_Type,Respondent_Affiliation,Location,Contextual_Clues,Contradictions,Additional_Notes
R1,"The greatest beauty of democracy is the opposition. The opposition is the very essence of democracy. To maintain the fabric of democracy, a strong opposition is crucial.",Democracy_Features,Procedural_Democracy,Government,SP,Uttar_Pradesh,The remark comes from someone who is currently a member of the opposition themselves.,NA,"Field notes corroborate that the respondent put emphatic emphasis on the role of the opposition in democracy, reiterating it multiple times throughout the interview."
R2,"The literal meaning is that the government is selected by the people of the country. That’s the literal meaning of a democracy—where the people of the country elect the government. And you have a system, like the US follows a different presidential system, in India we follow a different political system. Here, we have elections at various levels—from Panchayat level to urban development level and then to the [state] legislative to the Parliament level.",Democracy_Features,Procedural_Democracy,Media,Neutral,Uttar_Pradesh,Respondent draws attention to the US context to explain democracy in India. Also the context of multi-level democracy.,NA,"Textbook definition, but does draw attention to multi-level elections as a constitutive part of democracy."
R2,"But generally, people think that in villages, people don’t understand democracy. I think illiteracy has nothing to do with political literacy. They are more [politically] intelligent, they participate more, and there were leaders who used to say that election is a festival where everybody goes, and with that spirit, they go and they go in groups and vote. So, to say that the illiterate lot, which now has come down drastically, they don’t understand democracy will be wrong. The only thing is that they don’t use the word democracy—for them, it’s the electoral system.",Democracy_Features,Procedural_Democracy,Media,Neutral,Uttar_Pradesh,"The context of class differences in electoral participation is being used to highlight that the understanding of democracy among the masses in India remains tied largely to the act of voting. Additionally, there is the context of an assumed relationship between class and (political) literacy at lower levels.","It may be instructive to note that although the respondent is highlighting the active and intelligent voting behaviour of lower class people, they still use terms like ""the illiterate lot"" to refer to them, thus still exhibiting certain preconceived notions.","Field notes indicate that the respondent was moderately passionate about ""correcting"" a popular misconception regarding democratic awareness amongst poor people."
R11,"Then, democracy is also about how competitive and open it is. It means that the bar should not be too high for the entry of new political forces. For example, in the period from 1989 to 2014, of coalition governments, at that time, the bar was a little lower. It allowed a number of political parties and groups to contest elections, get space in government or power. After 2014, it has shrunk at the national level...For democracy to survive, you need fierce, competitive politics.",Democracy_Features,Procedural_Democracy,Media,Neutral,India,The respondent refers to coalition governments as a political and historical context in which the entry barriers were lower and democratic competition was higher.,NA,Highlights features as well as trends in democracy.
R11,"But of course, party politics and ideology is also important in democracy. But it must be very competitive, it must be very diverse and plural in nature. So, it seems to me that democracy means it’s an evolving system.",Democracy_Features,Procedural_Democracy,Media,Neutral,India,References to the importance of party politics and ideology; frames democracy in the context of its evolution.,NA,Highlights diversity and pluralism of political competition as additional features of democracy.
R11,"It is true that a prominent feature of India's democracy is that it has five-yearly elections, which is credited with the fact that elections are held regularly and are largely free and fair, except in some states. Conducting free and fair elections every five years and changing the government without shedding any blood or violence is the biggest achievement of Indian democracy.",Democracy_Features,Procedural_Democracy,Media,Neutral,India,Context of elections being free and fair in more states than not.,NA,Highlights free and fair elections as well as peaceful transfer of power as achievements of democracy.
R12,"Democracy whatever it means to you, same thing to me—government of the people, for the people, by the people. It’s a cliche definition, but that’s what it is. This means, I don't have a separate, individual, unique definition for India. It's the people's government. It should be for people, and they should have the last word in its formation and in its policies.",Democracy_Features,Procedural_Democracy,Bureaucrat,Neutral,Delhi,NA,NA,NA
R12,"The role of elections is very important, no doubt. Without elections there is no democracy. But one thing has to be understood: a good election is not a guarantee of good democracy.",Democracy_Features,Procedural_Democracy,Bureaucrat,Neutral,Delhi,NA,NA,"Respondent does note that while elections may be a necessary condition of democracy, they are not sufficient for normatively ""good"" democracy."
R13,"The periodic elections every five years inspire immense public trust. The people believe that if the government they elected does not perform well, they can replace it in five years. This belief has significantly shaped our democracy.",Democracy_Features,Procedural_Democracy,Party,BJP,Uttarakhand,There is an implicit context of performance assessment of the government by the public in democracy.,NA,The regular nature of elections and turnover highlighted as features of democracy.
R14,"Democracy, in essence, means freedom and the ability to make choices. Every five years, elections are held where people can freely choose their representatives, whether MPs at the national level or MLAs at the state level. When MLAs are elected, they form the state government if they achieve a majority. Similarly, MPs elected across the country form the central government. The party with the majority selects the Prime Minister. In a democracy, the most significant power lies in the vote, which is given by the people. The public places its trust in individuals or parties they believe will work for their benefit. They elect them, whether for an MP or MLA position. This is the essence of democracy: empowering the people to choose their representatives and place them in positions of responsibility.",Democracy_Features,Procedural_Democracy,Government,BJP,Uttarakhand,Context of elections at the state level and the national level in democracy.,NA,"Again, textbook definition, but the second person to draw attention to multi-level elections as a constitutive part of democracy."
R14,"The security of democracy lies in people using their votes impartially. It should not be that democracy is showcased as an illusion, while the process of voting is not transparent. It is often heard that people lose trust in the system. It is essential that voting is conducted impartially, without any manipulation. The decision made by the public must be reflected on the ground.",Democracy_Features,Procedural_Democracy,Government,BJP,Uttarakhand,"There is a broader context of elections or votes being manipulated or not remaining ""impartial"", but it is hard to decipher what constitutes impartiality to the respondent.","The victory of the BJPs counts as ""impartial"" voting to the respondent since it reflects the decision made by the public on the ground. At the same time, they allege that the opposition in certain other states are not transparent or impartial with conducting their voting process.","On the one hand, it is highlighting transparency and fairness in elections as necessary for sustaining trust in democracy. On the other hand, it is unclear what actually meets those criteria."
R17,"Look, democracy means ""of the people, for the people."" It is a system where people are directly involved in governance. It is what we call ""Janatantra"" — a government of the people. The public elects their representatives, those representatives then run the government, and that government works for the welfare of the people. Basically, it’s a cycle.",Democracy_Features,Procedural_Democracy,Government,BJP,Uttarakhand,There is an implicit context of the government working for the welfare of the people in a democracy.,NA,Second person to echo the exact Lincolnian definition of democracy.
R19,"The establishment of democracy in our country is in accordance with the Constitution. In a democracy, people vote to elect their government, and the government, once elected, works for the welfare of the people. You could say it is a system of governance chosen by the people for the people.",Democracy_Features,Procedural_Democracy,Government,INC,Uttarakhand,"Again, there is an implicit context of the government working for the welfare of the people in a democracy.",NA,Echoes almost the exact same sentiments as well as phrasing of R17. Third person to join in the Lincolnian definition of democracy. 
R22,"The word ""loktantra"" is a sacred term. In English, we call it ""democracy,"" and in Hindi, loktantra means governance by the people. It is built with the participation of the people, and respecting the sentiments of the people is the most important aspect of democracy because it is created by their votes.",Democracy_Features,Procedural_Democracy,Party,INC,Uttarakhand,NA,NA,Draws attention to the participation of the people in democracy.
R4,"Since I come from a village, I see that the real meaning of democracy, as envisioned in our Constitution, lies in concepts like Gram Swaraj (village self-rule) and the Panchayati Raj system. These are considered the essence of democracy.",Democracy_Features,Substantive_Democracy,Media,Neutral,India,Context of village background.,NA,"A very bottom-up, decentralised understanding of democracy. Third person to do so."
R4,"What is the essence of the democratic process? It is to convert the population into citizens. If we were to define democracy in one line, it would be: turning the population into active citizens. As citizens, people have both duties and rights—responsibilities and entitlements.",Democracy_Features,Substantive_Democracy,Media,Neutral,India,Context of citizenship and fundamental rights and duties as defined in the Constitution.,NA,Democracy defined as the substantive process of governmentality almost.
R5,"For me, democracy is exactly what is defined in our Constitution—whatever the Constitution says about fundamental rights, duties, and democracy. If you ask me whether I agree with this definition of democracy, I would say, for me, democracy is whatever is written in the Indian Constitution.",Democracy_Features,Substantive_Democracy,Media,Neutral,India,Context of fundamental rights and duties as defined in the Constitution.,NA,NA
R6,"The meaning of democracy is that every person, regardless of their political party, caste, or religion, should have the opportunity to act according to their own will.",Democracy_Features,Substantive_Democracy,Government,JMM,Jharkhand,NA,NA,Democracy as freedom.
R6,"Democracy is a form of governance, a system, a structure that, in today's time, exists as a constitutional arrangement. However, it is not just a social system. You see, there are two distinct entities—the state and society. Society has its own order, while the state has its own governance and administration. Democracy is a way of governance, but it is also a way of life. Specifically, when we speak of democracy in the social order, we must consider it from the perspective of democratic culture and constitutional principles.",Democracy_Features,Substantive_Democracy,Government,JMM,Jharkhand,NA,NA,Juxtaposition of a constitutional and a cultural understanding of democracy.
R6,"When I was young, I saw how, if a wedding took place in a village, the entire village would take collective responsibility for it. Nothing was brought from outside. Whether it was milk, buttermilk, or other necessities, everything was contributed by the people of the village. Everyone shared their belongings—beds, mattresses, household items—willingly. In my childhood, I remember how we would go door to door collecting beds and mattresses for weddings. The entire event was organized without any marketplace involvement. Everything was done through mutual cooperation. This cooperative way of life, where work was done with mutual consent and collective effort, was in itself democracy. In today's democracy, decision-making is based on a majority, but in earlier times, decisions were based on consensus. There was no concept of voting with a show of hands; rather, if a consensus could not be reached, there was acceptance (sweekriti), even if not complete agreement (sahmati). If there were ten people in a discussion, and eight agreed while two disagreed, the two would not resist but would say, ""We do not fully agree, but we accept the decision."" There was no culture of outright opposition; rather, it was about mutual acceptance.",Democracy_Features,Substantive_Democracy,Government,JMM,Jharkhand,Context of village background.,NA,"Democracy as cooperation, consensus, and mutual acceptance. Emphasises the lack of ""outright opposition"", which is interesting coming from a member of the opposition themselves.  "
R6,"This is the essence of democracy: a system where dialogue is possible, where open discussions take place, where thoughts are exchanged, and where decisions are made collectively. Democracy means that people engage in discussion (vichar), make decisions (nirnay), and then implement those decisions (kriya). These three elements—discussion, decision, and action—define governance. The same applies to the government.",Democracy_Features,Substantive_Democracy,Government,JMM,Jharkhand,NA,NA,The same respondent is now highlighting a deliberative understanding of democracy.
R6,"In reality, the existence of all entities lies within democracy itself. If we look at it closely, everyone’s existence is sustained through democracy, and any crisis in democracy is a crisis for everyone’s existence. Broadly speaking, democracy grants you the right to make decisions within your own sphere. That is its fundamental essence. It guarantees social, economic, and political justice, provides freedom of worship, freedom of residence, opportunities, and dignity. This is what democracy is. In the Indian Constitution, it is expressed in the form of justice, liberty, and equality. But this is not just a concept of the Indian Constitution; it is deeply embedded in Indian culture.",Democracy_Features,Substantive_Democracy,Government,JMM,Jharkhand,NA,NA,"Back to the understanding of democracy as freedom and justice, and as a juxtaposition of constitution and culture."
R6,"The very foundation of Indian culture is coexistence. Coexistence means that people can live together in harmony. This idea of coexistence is what defines Indian culture, and our culture is deeply rooted in this principle. The very essence of Indian culture is found in the village, which is why it is said that the soul of India resides in its villages. Villages represent family and neighborhood, coexistence and mutual dependence. This interconnected existence is democracy itself. We keep emphasizing the significance of the village because it is here that people live together, care for each other, and seek solutions that benefit all equally. This is the essence of democracy. It is about having the right to make decisions within one’s own domain, and when that domain expands, decision-making becomes collective. Individual leadership and collective leadership both coexist within this framework. If one were to deeply research this and conduct an extensive study, scientifically, many profound insights would emerge. My point is simply that all these elements are deeply ingrained in democracy.",Democracy_Features,Substantive_Democracy,Government,JMM,Jharkhand,NA,NA,"Democracy  is indeed multifaceted for this respondent. It is coexistence, justice, freedom, liberty, dialogue, mutual understanding, and so on."
R8,"If we take fundamental rights as a basis, for example, the right to practice any religion, the right to worship in one’s own way, and the right to propagate one's religion—this can be a major parameter.",Democracy_Features,Substantive_Democracy,Civil,SFI,Delhi,Context of fundamental rights as defined in the Constitution.,NA,NA
R9,"Democracy means ""everyone together, everyone’s progress."" (Sabka Saath, Sabka Vikaas). This is the essence of democracy. The difference between democracy and monarchy is that, in a democracy, the son of a peon or a tea seller can also reach the highest seat of power, while in a monarchy, this is not possible.",Democracy_Features,Substantive_Democracy,Party,BJP,India,"""Sabka saath, sabka vikaas"" is a slogan from the manifesto of the BJP. Also, the journey of Modi from being a tea seller to the Prime Minister is being used to justify the place of democracy. ",NA,Their definition of democracy is both intertwined with the developmental motto of the BJP and in opposition to monarchy.
R9,"India’s democratic system is unique in that no one is superior or inferior to anyone else. Our Constitution is designed in such a way that external forces cannot directly impose decisions on us, nor can anyone within the country unilaterally seize power. Let me give an example: when a notification is issued by the Honorable President of India, it first requires approval from the Cabinet led by the Prime Minister, and only then does the President sign it. This is a key difference between India and neighboring countries like Pakistan, Burma (Myanmar), and Nepal. In those nations, power is often seized by force, typically by the military. In India, such a scenario is impossible. The military does not dominate the nation, nor does the nation dominate the military; there is a perfect balance. India’s democracy ensures that everyone plays their role—whether it is the government, the judiciary, or any other institution. The government performs its responsibilities, the judiciary handles justice, and the military safeguards the nation without interfering in governance. This balance is the hallmark of true democracy.",Democracy_Features,Substantive_Democracy,Party,BJP,India,Context of comparison with neighbouring countries to highlight India's experience with democracy.,NA,"It is interesting that a member of the ruling party criticised with undermining the democracy of India through the concentration of power at the national level is also the one highlighting balance of powers as essential for democracy, even going to the extent of specifying that the Constitution does not allow anyone to dominate the nation. Perhaps this only extends to the military for the respondent. Also, it will become clear as we go on that many respondents from the BJP tend to repeatedly compare Indian democracy with the lack of democracy in neighbouring countries as a testament to its strength and continued existence."
R9,"There is a symbiotic relationship between development and democracy. By symbiotic, I mean that one cannot truly exist without the other—they are interdependent…. Democracy means giving everyone the freedom to voice their opinions and concerns. However, democracy alone cannot satisfy people's needs without development. When development occurs, people’s grievances naturally reduce, and the voices of dissatisfaction start diminishing. That’s why development must progress hand-in-hand with democracy. Without development, democracy would lose its essence because it would fail to address the needs of the people.",Democracy_Features,Substantive_Democracy,Party,BJP,India,"Context of ""Sabka Saath, Sabka Vikaas"" in the BJP's manifesto being important to the emphasis on development.",NA,NA
R9,"The basic criterion is that we should retain the right to express ourselves freely, without anyone suppressing us. Suppression means that no one should dominate us. We should be able to pursue our own development, gain education, work anywhere in the country or the world, and live freely. Without democracy, under systems like monarchy, you cannot act as per your own will. In a democracy, you can work freely while adhering to the state's rules. Without democracy, where authoritarianism prevails, you must act only according to the will of those in power, and you lack personal freedom. For instance, if you go to Thailand—a highly developed area where people travel for various purposes, including leisure—you will find it is a monarchy. There, it is mandatory to display the king's photo in every shop or restaurant. People are forced to display it. In India, however, it’s not mandatory to display the Prime Minister or President's photo everywhere except in government offices. This is the key difference between a democracy and a monarchy—democracy allows freedom, while monarchy imposes restrictions.",Democracy_Features,Substantive_Democracy,Party,BJP,India,Compares the context of mandatory person worship in Thailand under monarchy to the lack thereof under Indian democracy.,"The respondent asserted that it is not mandatory to play the PM's photo in India except in government offices. I then asked him about the directive of the government which made it compulsory for any public event to display the photo of the PM, as well as the immense public advertisements by the BJP which essentially did make it so that the PM's photo is in every public space such as metros. To this, the respondent only had to say that the people did this voluntarily out of their love for the PM.",NA
R10,"Every person in India has his own glasses to see democracy… Mostly, this is a highly misunderstood concept where people think that only casting their vote once in every five years in elections is democracy. I believe that simply voting once every five years is not democracy. After voting, in the remaining 365 into 5 minus 1 days that are left, meeting the eyes of the person you elected after casting your vote, asking questions of them, and holding them responsible and accountable for their acts, that is democracy. And this is what gives power to a country, a nation, a society or a group of citizens—not just by voting once. This is a practical definition.",Democracy_Features,Substantive_Democracy,Government,AAP,Delhi,"Respondent's definition of democracy is somewhat tied to the context of his membership in the AAP, which also advocates for a service-based politics in its manifesto.",NA,NA
R10,"MP/MLAs should be like postmen: those who bring public problems to the cabinet, bring them to the house, and legislate such policies which address these problems. This is the purest form of democracy.",Democracy_Features,Substantive_Democracy,Government,AAP,Delhi,Same context of party membership.,NA,NA
R11,"Because if seen from the perspective of academic training, democracy is multifaceted. It’s not just about electing your representative every five years, it’s deliberative, it’s also giving space to many social movements, political movements, movements which are beyond party politics.",Democracy_Features,Substantive_Democracy,Media,Neutral,India,"Ties it to the context of recent protests being necessary for democracy in India, such as Farmers protest, Shaheen Bagh protests, and so on. ",NA,"Democracy highlighted as multifaceted: deliberative, inclusive, mobilization, and so on."
R11,"Democracy has a very wide definition. Everyone should be included, I think… That, in the overall picture of democracy, which has publics in different sections of the society—either caste, or class, or ethnicities—whether they are able to find their space or not.",Democracy_Features,Substantive_Democracy,Media,Neutral,India,NA,NA,NA
R11,"See, because ultimately, democracy in India by nature is about championing and allowing the expression of regional sentiments or regional forces. So, the idea of democracy, you know, is strengthened if regional aspirations are allowed or given space to express themselves. Number one.",Democracy_Features,Substantive_Democracy,Media,Neutral,India,Context of regional politics,NA,Highlights that space for regional aspirations and political forces is important for democracy. The fourth person to do so now.
R11,"And for India, I think many people value its institutional dimension—that is, independent institutions, particularly judiciary and media. These are the two key institutions...very important in democracy apart from the other three. Second, the issue of accountability is also very important. Accountability of the legislature as well as other institutions to the public.",Democracy_Features,Substantive_Democracy,Media,Neutral,India,NA,NA,Institutions and their accountability also highlited as important for democracy.
R11,"I think we should all strive for free and fair elections, independent institutions, including an independent judiciary and critical media, social and political movements. These are the important factors that if they are getting strengthened, I think democracy in India will survive. But if these tendencies are crushed and unable to find proper space, democracy is in danger.",Democracy_Features,Substantive_Democracy,Media,Neutral,India,NA,NA,NA
