Interview_ID,Response,Theme,Subtheme,Respondent_Type,Respondent_Affiliation,Location,Contextual_Clues,Contradictions,Additional_Notes
R19,"In theory, democracy provides freedom to every individual, but in practice, communalism has become a game that is being played. What happens in democracy is that, during elections, parties present a manifesto, make promises to the people, and then try to fulfil those promises. However, today, the opposite is happening. Governments elected for five years are not focusing on development or the roadmap they presented. Instead, by the time elections arrive, they are playing communal games. This communalism creates divisions among people, and I believe it is not only a threat to democracy but also to the nation itself.",Democracy_Trends,Communalism,Government,INC,Uttarakhand,NA,NA,"Communalism cited as a threat to Indian democracy and the nation itself, but the reason cited primarily concerns communalism diverting attention from development and destroying ""harmony."""
R19,"The biggest challenge is communalism. The responsibility of any government is to maintain harmony in the country, but the opposite is happening today. The very people in power are working to disrupt harmony. If we claim to be a democracy and such actions continue, it weakens the foundation of democracy and acts contrary to the principles of the Constitution.",Democracy_Trends,Communalism,Government,INC,Uttarakhand,NA,NA,The BJP is identified as the primary driver of communalism.
R19,"There has been deterioration [of democracy]. If there hadn’t been, then during elections, why would this communal game be played? When one goes into elections, the focus should be on the promises made to the people and on the developmental work done over the past five years. But that’s not the case. Today, the discussion revolves around Hindus, Muslims, Sikhs, and Christians instead. The result of this is that democracy is weakening.",Democracy_Trends,Communalism,Government,INC,Uttarakhand,NA,NA,"Interesting to think about the direction of causality here. The respondent cites communal games as evidence of ongoing democratic backsliding, but expresses it such that it seems like a natural consequence of backsliding."
R23,"At present, there are many issues. Problems exist on both sides—on the leadership side, among the representatives being elected, and on the public side as well. Although the level of education in the country has increased, the sensitivity among people has decreased. Politics is being played in the name of religion, and the consequence of this is that the ruling party is doing whatever it wants while the public's attention is not on important matters. Division is being created among people in the name of religion. The way Afghanistan and Pakistan have faced consequences, India seems to be moving in a similar direction.",Democracy_Trends,Communalism,Party,INC,Uttarakhand,Context of neighbouring countries such as Pakistan and Afghanistan invoked to signal the direction India is currently moving in.,NA,"Communalism by the BJP is both creating division and also diverting the attention of the public from more ""important"" matters. What these might be are not clearly specified."
R23,"The narratives being set include the Hindu-Muslim divide. Sometimes it’s about shrines, sometimes about madrasas, and the choice of words being used politically, like jihad. For example, when discussing land encroachment, it is labeled as land jihad instead of simply stating that the land has been occupied. Even in cases of illegal encroachments on municipal land, the government does nothing to stop it. But by highlighting only the 6 or 4 shrines, they are creating a specific atmosphere.",Democracy_Trends,Communalism,Party,INC,Uttarakhand,Religious politicisation of seemingly non-religious issues.,NA,Examples of where religious divide is being created.
R23,"Leaders certainly have a role to play, but it all starts with the public. If voting behavior isn’t right, if you are voting based on gestures like folded hands or religious considerations—Hindu or Muslim—you’re not bringing in good representatives or educated people. How can the system improve then? Laws will only be as good as the lawmakers. This is the most important aspect, and there must be awareness about what truly matters to us. The public needs to decide its priorities. Only educated individuals can be expected to understand this, and they need to be sensitive to the issues. If we blindly follow what the media shows or what a leader says in their speeches, things will never improve. Educated people must take responsibility so that at least positive debates can take place in society.",Democracy_Trends,Communalism,Party,INC,Uttarakhand,NA,NA,"Responsibility also placed on people, specifically ""educated"" people, to change their voting behaviours in order to combat communalism."
R1,"The Parliament has immense authority—an overwhelming authority—to amend any law. Over time, numerous amendments have been made, and if something doesn’t align with their interests, they amend it as they see fit.",Democracy_Trends,Institutional_Threats,Government,SP,Uttar_Pradesh,NA,NA,NA
R6,"Another important issue just came to my mind. Until recently, the appointment of the Chief Election Commissioner was done by a three-member committee, which included the Prime Minister, the Leader of the Opposition, and the Chief Justice of the Supreme Court. This ensured a balance in decision-making. The Chief Election Commissioner holds a highly significant position because they are responsible for conducting elections fairly and ensuring that they are not biased. The presence of the Leader of the Opposition ensured that the selection of the Election Commissioner was fair. The Prime Minister, being the head of the government, would also play a key role in the decision, and the third member, the Chief Justice of India—one of the pillars of democracy—ensured judicial oversight. But suddenly, since the ruling party has a majority in Parliament, they changed this system. Now, they have removed the Chief Justice from the selection process. The committee will still include the Leader of the Opposition, but now, in addition to the Prime Minister, there will be a cabinet minister appointed by the Prime Minister himself. This means that the balance has shifted—two members will be from the ruling party, while only one will be from the opposition. The cabinet minister, being selected by the Prime Minister, will naturally vote in favor of whoever the ruling party wants as the Chief Election Commissioner. Now, if the Election Commissioner is selected entirely at the discretion of the ruling party, then how can elections be conducted fairly? What will happen to democracy? The upcoming elections will now be overseen by an Election Commissioner who has been chosen by the Prime Minister and his appointed minister. The Leader of the Opposition will have only one vote, making their role nearly irrelevant. So how can anyone say that our democracy is safe?",Democracy_Trends,Institutional_Threats,Government,JMM,Jharkhand,Very important context of a recent change in the process of the apointment of the Chief Election Commissioner.,NA,Important example of recent institutional decay in Indian democracy; BJP singled out as the reason for this change.
R6,"But the problem is that if laws are being made in Parliament, then it is through those laws that democracy can be safeguarded. If the appointment of the Election Commissioner is being done within Parliament itself, the issue arises that the majority in power will always shape the laws according to their own interests. The real concern is that, at the moment, democracy is being systematically dismantled in ways we have never seen before. Earlier, there was never such large-scale political engineering as we see now. The ruling party at the center has overturned democratically elected governments across various states. They have manipulated elected representatives, turned them in their favor, and brought down state governments. Now, I don’t have concrete evidence of whether they were bribed, coerced, or blackmailed, but what happened in Maharashtra is clear. The Prime Minister himself made serious allegations against Ajit Pawar, and yet, after a while, Ajit Pawar was brought into their own party and given a ministerial position. If someone was corrupt, as they themselves claimed, then how is it that as soon as he joins their party, he is fit to become a minister? The same happened with Himanta Biswa Sarma and Chhagan Bhujbal. BJP leaders previously accused them of corruption, but as soon as they switched sides and joined the ruling party, those accusations disappeared. In fact, it was even said that Chhagan Bhujbal's corruption case files had ""gone missing."" Selective action is being taken—investigative agencies, which are supposed to be neutral and unbiased, are disproportionately targeting opposition leaders. If you look at the statistics, the vast majority of Enforcement Directorate (ED) cases are being filed against opposition leaders. These agencies are being used not for justice, but as tools of intimidation, to harass, threaten, and imprison those in opposition. When this happens, it raises serious concerns about whether democracy is truly safe.",Democracy_Trends,Institutional_Threats,Government,JMM,Jharkhand,Context of events in Maharashtra and Assam with specific politicians.,"Possible contradiction could be that the party of the respondent is also ""guilty"" of creating defections in the opposition, as is almost every single party in the country.",Political engineering by the ruling party in the name of majoritarianism; toppling of state governments; harassment and eventual defection of opposition leaders.
R10,"[The] BJP is sort of able to find a way to bend them [democratic institutions]. If not, they are creating a way.",Democracy_Trends,Institutional_Threats,Government,AAP,Delhi,NA,NA,BJP singled out.
R11,"I broadly agree with the assertion which many academics, human rights organizations, media organizations, and opposition parties are sharing that at the national level, democratic space is shrinking. Autocratic tendencies are increasing and getting strengthened. Institutions are compromising or succumbing to the pressure which is coming from the executive. Including the media, especially the media and judiciary.",Democracy_Trends,Institutional_Threats,Media,Neutral,India,NA,NA,"BJP singled out, and media and judiciary singled out as the institutions under the biggest threat."
R11,"Then, there is the process of making institutions of democracy “vacant.” Because ultimately democracy depends on independent institutions and checks and balances. But, let's say, one of the key features of Indian democracy is free and fair elections. If that is, you know, going to be compromised or altered, then there will be a major difference.",Democracy_Trends,Institutional_Threats,Media,Neutral,India,NA,NA,"Very importantly the BJP is argued to be engaged in the specific process of undermining democracy by making iinstitutions of democracy ""vacant""."
R12,"Current state of Indian democracy is awful. All institutions of democracy are in tatters. On top of that, election commission, which was once the pride of India, it fell under question. And big articles, comments and editorials keep appearing in the newspapers on it. Democracy depends on the incumbent and also the incumbent government. This government has ruined all the institutions deliberately. They conduct raids. You know the case of Ashok Lavasa. They had raids conducted on his wife, his child, everybody because he wanted a Model Code of Conduct notice issued to Modi and Amit Shah. There is a Sunil Arora; he single-handedly ruined his reputation. You remind me, I’ll send you thirty-four headlines in different newspapers from Sunil Arora’s time. The same Election Commission that was the pride of India was described as disgraced and rejected like this. So, these indexes are always performance sensitive. Brother, if your performance is bad, then that will get reflected.",Democracy_Trends,Institutional_Threats,Bureaucrat,Neutral,Delhi,Context of the respondent being an ex-Chief Election Commissioner themselves is important.,NA,Numerous examples of raids being conducted by the BJP against former Chief Election Commissioners and the decline of this institution.
R12,"No, the role of elections is very important, no doubt. Without elections there is no democracy. But one thing has to be understood: a good election is not a guarantee of good democracy. Which is why, in the Economist Index, we are still regarded as a flawed democracy. We got 9.7 marks out of 10 in elections. But in the quality of democracy, we got 5, 6 marks. Why? Because we conducted fair elections, but if a person A with a criminal record, murder-kidnapping, is selected, we have no role in that.",Democracy_Trends,Institutional_Threats,Bureaucrat,Neutral,Delhi,NA,NA,"Respondent highlights a prominent problem in Indian politics allegedly exacerbated under the BJP: Though elections may be free and fair and highly regarded by international bodies, they are not leading to good governance. For example, they claim people are using free and fair elections to elect criminals which is bad for democracy."
R12,"If they win again with a majority, they will destroy whatever is left of democracy. They will change the constitution itself. Earlier they always used to say that RSS is against the constitution, and they will change it. But many people think that they don't have to change the constitution, they have created the Hindu Rashtra already within the same constitution. There is no need to change it. Now, if they bring a presidential form of government in the name of “one nation, one election,” then frankly Modi vs Rahul Gandhi is no contest.",Democracy_Trends,Institutional_Threats,Bureaucrat,Neutral,Delhi,NA,NA,Respondent predicts the BJP to change the very constitution if they are elected with a majority again.
R12,"Maybe the media could have done all this, but now the media has sold itself. Totally sold media, so who will fight for it. Only these poor innocent YouTube channels are left. By the way, they are all Brahmins - some are Sharma, some are Bajpai - they are fighting. But on YouTube also, they will come down heavily very soon. You just watch. They are fully prepared for the crackdown on them. Next, they will also be gagged. You will not even get to know the truth. That is what happens in a fascist government.",Democracy_Trends,Institutional_Threats,Bureaucrat,Neutral,Delhi,NA,NA,BJP compared to a fascist government and accused of cracking down on independent media as well.
R12,"If they come into power in more than half of the states in the future, they will surely make constitutional amendments. Now, if someone says that ""one nation, one election"", it is impossible because five articles of the constitution will have to be changed. But the entire constitution will be changed if they get the majority. So, what good are these five articles? Kashmir was abolished. Kashmir was made a Union Territory, right? And the seal of the Supreme Court was also put on it. Because their modus operandi is to blackmail everyone. They control all the institutions. They will open the files of ED, Income Tax etc., they will find some weakness of theirs, and then tell the Chief Justice that this is all the evidence against you, think about it, then tell us what should be done? This is happening. You should see what the judgements are of last 5-7 years.",Democracy_Trends,Institutional_Threats,Bureaucrat,Neutral,Delhi,Context of the abbrogation of Article 370 in Kashmir.,NA,NA
R12,"No, look, this was also a hot topic today that the Supreme Court took such a dangerous decision that sitting in the Parliament it made Kashmir a Union Territory. Rather, two Union Territories. What is to stop them from making Tamil Nadu a Union Territory? After the judgement of the Supreme Court, if any state protests, then just make it a Union Territory. If you want, you can even make it four union territories. No one challenged the Supreme Court. The Supreme Court was disgraced. Well, Kashmir was a special case—Kashmir had to be integrated, national interest was involved. But has India's democracy and federalism become a waste?",Democracy_Trends,Institutional_Threats,Bureaucrat,Neutral,Delhi,Context of the abbrogation of Article 370 in Kashmir.,NA,NA
R19,"The government is acting against the principles of the Constitution. The decline has reached such a point that we have numerous examples in front of us. Agencies like the CBI, ED, and Income Tax are being misused. Is such misuse appropriate for a free democracy? These agencies are supposed to function independently, but they are being weaponized against the opposition to eliminate dissent.",Democracy_Trends,Institutional_Threats,Government,INC,Uttarakhand,NA,NA,BJP is singled out as misusing executive authority and being against the Constitution.
R22,"But today, the situation has worsened. Our democratic rights are being eroded. The Prime Minister does not hold press conferences. I am not just speaking about this Prime Minister—any Prime Minister in a democracy must be accountable. They should answer to the Parliament, but today, even Parliament is being undermined. The Supreme Court is being interfered with. For the first time in the history of this great democracy, four judges held a press conference and declared that the country’s democracy is in danger. That same threat is evident today… Ask the bureaucracy, which is supposed to function within a democracy. If you ask a senior bureaucrat about the current situation, they will be afraid. They speak with fear. The most significant decline is that even while living in a democracy, we are now living in an atmosphere of fear.",Democracy_Trends,Institutional_Threats,Party,INC,Uttarakhand,Prime Minister not holding press conferences while judges of the Supreme Court hold a press conference to express fears of executive interference.,NA,BJP is singled out.
R22,"In our Parliament, we’ve seen numerous scandals. During those times, the opposition wasn’t as strong as it is today. But now, instead of strengthening the opposition, efforts are being made to weaken it. Rahul Gandhi suggested, “Fine, form a Public Accounts Committee (PAC) or a Joint Parliamentary Committee (JPC) to investigate.” But today, Parliament doesn’t even allow proper hearings. Assemblies are being weakened, and efforts are being made to eliminate political parties altogether. For the first time in the history of Indian democracy, enforcement agencies like the ED (Enforcement Directorate) and Income Tax Department are being used to attack a political party’s funding. This is not healthy for democracy. Even if it’s my own party, I must acknowledge when something wrong happens. I mentioned the Emergency earlier—it was a mistake. Leaders like Jayaprakash Narayan led a movement against it. You come from this sacred democratic tradition, and protecting it is essential.",Democracy_Trends,Institutional_Threats,Party,INC,Uttarakhand,Context of a suggestion made by Rahul Gandhi.,NA,"Important to note that respondent argues that they are not biased by highlighting that the Emergency was a mistake, so they will also call out their own party for undertaking measures not good for democratic health."
R23,"No part of the system is unaffected by this—not the judiciary, not journalism, which are both critical for keeping things in check… Several incidents have taken place where judges who gave verdicts favorable to the government were later seen in the Rajya Sabha. Everyone has witnessed this. It is a glaring example of shamelessness. At this time, political change is being driven by the setting of narratives, which will lead to very serious consequences in the future.",Democracy_Trends,Institutional_Threats,Party,INC,Uttarakhand,NA,NA,The judiciary cited as responsible for delivering judgements favourable to the ruling party (the BJP).
R1,"I’ve already told you what happens to those who raise slogans. Ten years ago, people used to raise slogans, they would be arrested, and then they would be released. That used to happen ten years ago. It doesn’t happen like that anymore… The people who used to raise slogans are now exhausted, and no one listens to them anymore. That’s the clear reality of the situation.",Democracy_Trends,Rights_and_Liberties_Threats,Government,SP,Uttar_Pradesh,NA,NA,NA
R1,"No, no, they won’t just be divided—they will immediately be labeled as anti-state. What used to happen earlier in politics was that we used to raise our voice on the streets—whether it was due to rising gas cylinder prices or increasing electricity bills—the opposition would take to the streets to protest. They would get arrested but would eventually be released. However, in this government, everyone who has been arrested has been charged under sedition laws. Once you’re labeled as a seditionist, no one will stand with you. For instance, while I might enjoy engaging in politics, the poor people who walk alongside me won’t take that risk. And when I am left alone, who will hear my voice? The real issue arises when, under this democracy, the misuse of laws is silencing leaders. In such circumstances, how can there be hope? Everyone is content to stay at home, eating their rice and lentils, and remaining unconcerned.",Democracy_Trends,Rights_and_Liberties_Threats,Government,SP,Uttar_Pradesh,NA,NA,"BJP singled out as responsible for silencing protests and protest leaders. An interesting claim made by the respondent is that harsh actions against protestors seems to be an ever-present reality in Indian democracy. But they also emphasise that while protestors might have been jailed in the past, they were always released after. Now, they are not even being released but jailed indefinitely. So, it is not that situation has gone from good to bad but from bad to worse."
R2,"Mobilization in favour of Yogi you do see. But against, as I told you, it’s much, much harder. I guess we will get to know now [referring to the upcoming elections]. Only in private conversations will people discuss or criticize the government, they will not do so publicly.",Democracy_Trends,Rights_and_Liberties_Threats,Media,Neutral,Uttar_Pradesh,Context of Uttar Pradesh political environment.,NA,"From the field notes it is clear that the respondent was hesitant to directly attribute the fear of speaking out to the BJP, but it is implicit from their statements that indicate mobilization is only possible in favour the incumbents, not against them."
R5,"At this point, democracy essentially boils down to one thing—""You have the right to vote."" Once you have cast your vote, democracy is done for you. Sure, we have Fundamental Rights, but ask yourself—are these rights actually enforced? Do all citizens truly get to exercise them? I don’t think so, especially for those at the lower levels of society. Even today, in many temples across India, there are signboards that explicitly state that people from certain communities are not allowed to enter. So tell me—isn’t the ‘Right to Equality’ completely erased at that point?",Democracy_Trends,Rights_and_Liberties_Threats,Media,Neutral,India,NA,NA,Discrimination against people from lower castes in temples pointed to as example of the degradation of the Right to Equality. No single party or context is singled out though.
R5,"There’s also the other aspect—what Dr. B.R. Ambedkar gave us. He ensured that at least we have the judiciary to protect our rights. If we feel that our fundamental rights are being violated, we can take the matter to court. But what happens in reality? In India, if you file a simple civil suit—say, a minor land dispute—it drags on for generations. A grandfather starts the case, and by the time his grandson grows old, it’s still unresolved. Yes, even a common man technically has the right to fight for his rights in court. But how affordable is it? Judicial processes have become so expensive that 95% of India’s population cannot even afford them. If your case reaches the Supreme Court, a regular lawyer charges ?2 lakh to ?3 lakh per hearing. Now tell me—can a poor or lower-middle-class person even dream of taking their case to court? If something unjust happens to them, do they even have an option? This is the reality of our democracy today.",Democracy_Trends,Rights_and_Liberties_Threats,Media,Neutral,India,NA,NA,Democracy today is not accessible to the common people seems to be the major theme.
R8,"Democracy is a very fashionable term. What’s interesting about it is that even those who are fundamentally undemocratic prefer to call themselves democrats. They also invoke democracy, even if they’ve historically been against it.",Democracy_Trends,Rights_and_Liberties_Threats,Civil,SFI,Delhi,NA,NA,BJP singled out for adopting a democratic façade for legitimacy.
R8,"If we take the fundamental features of the Indian Constitution—what we call fundamental rights—as a benchmark and evaluate the attitude of different states toward these rights, then we see a pattern. In recent years, the central government has often positioned itself in opposition to fundamental rights. In fact, in many instances, it actively curtails the fundamental rights granted to Indian citizens. Our right to freedom of expression, our right to assemble and protest peacefully, our right to practice and propagate religion—these are all fundamental rights.",Democracy_Trends,Rights_and_Liberties_Threats,Civil,SFI,Delhi,Context of fundamental rights as defined in the Constitution.,NA,BJP singled out.
